{"schema_version":"1.0","scenario_id":"f05-hot-key-repaired","pair_id":"F05","variant":"repaired","seed":905,"topology":{"nodes":["n1","n2","n3"],"leader":"n1","replication_factor":3},"partitioning":{"strategy":"hash","partitions":12},"initial_state":{"transient-42":"new"},"operations":[{"id":"r1","type":"read","key":"transient-42","tenant":"public","session":"a"},{"id":"r2","type":"read","key":"transient-42","tenant":"public","session":"b"},{"id":"r3","type":"read","key":"transient-42","tenant":"public","session":"c"},{"id":"r4","type":"read","key":"private-index","tenant":"private","session":"ops"}],"fault_schedule":{"type":"hot_key","key":"transient-42","multiplier":30},"control":{"write_ack":"majority","read_policy":"replicated-cache","preserve_conflicts":false,"repair":"none","session_enforcement":"none","leader_policy":"unchanged","hot_key_mitigation":"split-read-load-and-tenant-reserve","reshard_strategy":"none"},"prediction":"Read load spreads across replicas and an explicit tenant reserve rejects excess public work first.","evidence_boundary":"Synthetic counts expose skew and fairness mechanics, not production CPU or latency."}
