{"schema_version":"1.0","scenario_id":"f06-reshard-under-load-repaired","pair_id":"F06","variant":"repaired","seed":906,"topology":{"nodes":["n1","n2","n3"],"leader":"n1","replication_factor":3},"partitioning":{"strategy":"hash","partitions":8},"initial_state":{"object-0":"v1","object-1":"v1","object-2":"v1","object-3":"v1","object-4":"v1","object-5":"v1","object-6":"v1","object-7":"v1"},"operations":[{"id":"add","type":"add_node","key":"n3","tenant":"public","session":"operator"},{"id":"w1","type":"write","key":"object-2","value":"v2","tenant":"public","session":"ingest"},{"id":"r1","type":"read","key":"object-2","tenant":"public","session":"researcher"}],"fault_schedule":{"type":"reshard_under_load","new_node":"n3"},"control":{"write_ack":"majority","read_policy":"old-then-new-map","preserve_conflicts":true,"repair":"copy-verify","session_enforcement":"token","leader_policy":"unchanged","hot_key_mitigation":"none","reshard_strategy":"consistent-hash-staged-cutover"},"prediction":"Staged transfer verifies copied keys before cutover and consistent hashing bounds movement.","evidence_boundary":"The model measures deterministic key movement, not transfer bandwidth or consensus on ownership."}
